{
  "job_id": "wo_silverback-agent_regenerate_report_20251222_144229_001",
  "product_id": "silverback-agent",
  "intent": "regenerate_report",
  "inputs": {
    "product_id": "silverback-agent"
  },
  "budget": {
    "max_actions": 1,
    "max_seconds": 120
  },
  "stop_conditions": [
    "on_silverback_fail",
    "on_test_fail",
    "on_missing_evidence"
  ],
  "priority": 100,
  "created_at": "2025-12-22T14:42:29.650340Z",
  "constitution_refs": [
    "constitution.md"
  ],
  "evidence_expectations": [
    "dash/runs/silverback-agent/last_run.json"
  ],
  "status": "completed",
  "result": {
    "exit_code": 0,
    "completed_at": "2025-12-22T23:33:29.012874Z",
    "duration_seconds": 3.942627,
    "evidence_produced": [
      "dash/runs/silverback-agent/last_run.json"
    ],
    "error_message": ""
  }
}