{
  "job_id": "wo_codemonkeys-cli_test_002",
  "product_id": "codemonkeys-cli",
  "intent": "test",
  "inputs": {
    "product_id": "codemonkeys-cli"
  },
  "budget": {
    "max_actions": 1,
    "max_seconds": 300
  },
  "stop_conditions": [
    "on_test_fail"
  ],
  "priority": 80,
  "created_at": "2025-12-22T19:06:58.594543Z",
  "constitution_refs": [
    "constitution.md"
  ],
  "evidence_expectations": [],
  "status": "pending"
}