{
  "job_id": "wo_spec-kit_validate_20251222_215920_001",
  "product_id": "spec-kit",
  "intent": "validate",
  "inputs": {
    "product_id": "spec-kit"
  },
  "budget": {
    "max_actions": 1,
    "max_seconds": 120
  },
  "stop_conditions": [
    "on_silverback_fail"
  ],
  "priority": 70,
  "created_at": "2025-12-22T21:59:20.133864Z",
  "constitution_refs": [
    "constitution.md"
  ],
  "evidence_expectations": [],
  "status": "pending"
}