{
  "job_id": "wo_spec-kit_test_002",
  "product_id": "spec-kit",
  "intent": "test",
  "inputs": {
    "product_id": "spec-kit"
  },
  "budget": {
    "max_actions": 1,
    "max_seconds": 300
  },
  "stop_conditions": [
    "on_test_fail"
  ],
  "priority": 60,
  "created_at": "2025-12-22T21:32:44.083302Z",
  "constitution_refs": [
    "constitution.md"
  ],
  "evidence_expectations": [],
  "status": "pending"
}