{
  "job_id": "wo_codemonkeys-cli_validate_001",
  "product_id": "codemonkeys-cli",
  "intent": "validate",
  "inputs": {
    "product_id": "codemonkeys-cli"
  },
  "budget": {
    "max_actions": 1,
    "max_seconds": 120
  },
  "stop_conditions": [
    "on_silverback_fail"
  ],
  "priority": 90,
  "created_at": "2025-12-22T19:43:35.946892Z",
  "constitution_refs": [
    "constitution.md"
  ],
  "evidence_expectations": [],
  "status": "pending"
}