{
  "job_id": "wo_codemonkeys-dash_validate_20251222_233313_003",
  "product_id": "codemonkeys-dash",
  "intent": "validate",
  "inputs": {
    "product_id": "codemonkeys-dash"
  },
  "budget": {
    "max_actions": 1,
    "max_seconds": 120
  },
  "stop_conditions": [
    "on_silverback_fail"
  ],
  "priority": 90,
  "created_at": "2025-12-22T23:33:13.536000Z",
  "constitution_refs": [
    "constitution.md"
  ],
  "evidence_expectations": [],
  "status": "pending"
}