{
  "job_id": "wo_codemonkeys-dash_test_20251222_215920_004",
  "product_id": "codemonkeys-dash",
  "intent": "test",
  "inputs": {
    "product_id": "codemonkeys-dash"
  },
  "budget": {
    "max_actions": 1,
    "max_seconds": 300
  },
  "stop_conditions": [
    "on_test_fail"
  ],
  "priority": 80,
  "created_at": "2025-12-22T21:59:20.133898Z",
  "constitution_refs": [
    "constitution.md"
  ],
  "evidence_expectations": [],
  "status": "pending"
}