{
  "job_id": "wo_codemonkeys-cli_validate_20251222_144229_003",
  "product_id": "codemonkeys-cli",
  "intent": "validate",
  "inputs": {},
  "budget": {
    "max_actions": 1,
    "max_seconds": 120
  },
  "stop_conditions": [
    "on_silverback_fail",
    "on_test_fail",
    "on_missing_evidence"
  ],
  "priority": 50,
  "created_at": "2025-12-22T14:42:29.650358Z",
  "constitution_refs": [
    "constitution.md"
  ],
  "evidence_expectations": [
    "dash/runs/codemonkeys-cli/last_run.json"
  ],
  "status": "pending"
}